{
  "name": "Electro Grappling Line",
  "points": 5,
  "type": "Gear",

  "restrictions": {
    "units": ["Sabine Wren"]
  },

  "usage": "Exhaust",

  "action": {
    "actions": 1,
    "target": {
      "range": [1],
      "inLineOfSight": true,
      "is": {
        "unitTypes": ["Trooper"],
        "hostile": "Enemy"
      }
    },
    "grants": {
      "tokens": {
        "Immobilize": 2,
        "Suppression": 2
      }
    }
  }
}
