{
  "name": "Phase I Clone Captain",
  "points": 15,
  "type": "Personnel",

  "restrictions": {
    "units": ["Phase I Clone Troopers"]
  },

  "usage": "Exhaust",

  "description": "When you activate, you cannot remove suppression tokens or be suppressed during this activation.",

  "keywords": {
    "passiveForUnit": {
      "$Add Upgrade": "Training"
    },
    "passiveForUpgrade": {
      "Leader": null
    }
  }
}
