{
  "name": "Integrated Comms Antenna",
  "points": 3,
  "type": "Comms",

  "restrictions": {
    "unitTypes": [
      {
        "primary": "Trooper",
        "secondary": "Droid Trooper"
      }
    ]
  },

  "description": "During the Command Phase, you can be issued orders by friendly Commander or Operative inits at range 1-4."
}
