{
  "name": "Force Guidance",
  "points": 10,
  "type": "Force",

  "usage": "Exhaust",

  "action": {
    "actions": 0,
    "target": {
      "amount": 2,
      "range": [1, 2],
      "is": {
        "hostile": "Friendly"
      }
    },
    "grants": {
      "tokens": {
        "Surge": 1
      }
    }
  }
}
