{
  "name": "Stormtrooper Specialist",
  "points": 15,
  "type": "Personnel",

  "restrictions": {
    "units": ["Stormtroopers"]
  },

  "usage": "Exhaust",

  "action": {
    "actions": 0,
    "description": "Gain 1 aim token or 1 surge token.",
    "target": {
      "is": "Self"
    },
    "grants": {
      "tokens": {
        "Aim": 1,
        "Surge": 1
      },
      "maxTokensOfAnyType": 1
    }
  },

  "keywords": {
    "passiveForUnit": {
      "$Add Upgrade": "Gear"
    }
  }
}
