{
  "name": "E-11D Grenade Launcher Config",
  "points": 8,
  "type": "Armament",

  "restrictions": {
    "units": ["Imperial Death Troopers"]
  },

  "usage": "Exhaust",

  "keywords": {
    "passiveForUpgrade": {
      "Reconfigure": "E-11D Focus Fire Config"
    }
  },

  "weapon": {
    "name": "E-11D Grenade Launcher Config",
    "range": [1, 2],
    "dice": { "red": 1 },
    "keywords": {
      "Blast": null
    }
  }
}
