{
  "name": "General Weiss",
  "points": 10,
  "type": "Pilot",

  "restrictions": {
    "factions": ["Galactic Empire"],
    "unitTypes": [{ "Vehicle": "Ground Vehicle" }],
    "isUnique": true
  },

  "usage": "Exhaust",

  "action": {
    "actions": 0,
    "description": "Until the end of your activation, you gain Arsenal 2.",
    "target": {
      "is": "Self"
    },
    "grants": {
      "keywords": {
        "Arsenal": 2
      },
      "duration": "EndOfActivation"
    }
  }
}
