{
  "name": "Iden's TL-50 Repeater",
  "points": 15,
  "type": "Armament",

  "restrictions": {
    "units": ["Iden Versio"],
    "isUnique": true
  },

  "weapon": {
    "name": "Iden's TL-50 Repeater",
    "range": [1, 3],
    "dice": { "red": 2, "black": 1, "white": 2 },
    "keywords": {
      "Critical": 1,
      "Impact": 1
    }
  }
}
